{
  "schemaVersion": "1.0.0",
  "portal": "agency",
  "figmaFileKey": "4bh29laapcuKBTghfaRXF0",
  "$note": "Expanded 2→16 entries on 2026-09-10 (C360-47328; count corrected from an earlier 15/13 miscount the same day). Every nodeId is grounded: measured in its contract or existence-probed live the same day. componentKey (Figma's 40-hex component key) is only obtainable via the Plugin API — the 14 entries carrying componentKey: null await Figma-AI's enumeration (requested on C360-47328); nodeId is the working identifier until then. RENAMED 2026-09-11: field-type-1/2/3 -> form-field-primary/secondary/tertiary, matching the live Figma component names (the 'type N' vocabulary was legacy repo naming Figma had already moved past). || componentKeys filled 2026-09-16 from Figma-AI's Plugin-API extraction (C360-44235 #634434), accepted by exact nodeId match; note: that comment's 'oldNodeId' column lists ids that never existed in this file — its 'all nodeIds stale' claim was false, and its 'new' ids equal the ids this mapping has carried (live-verified) since 2026-09-10/14.",
  "components": [
    {
      "name": "Button",
      "componentKey": "3db16e6d1c87cd2bbf26189ef94be6a24eb872a9",
      "nodeId": "26938:66536",
      "maturity": "draft",
      "semanticDependencies": [
        "shared/primitives",
        "portals/agency/semantics/color-modes",
        "portals/agency/semantics/density-modes"
      ],
      "contractPath": "portals/agency/components/button.md",
      "jiraIssue": "C360-44256",
      "snapshotRef": "measured-live-figma-2026-08-24",
      "componentKeyNote": "CONFLICT recorded 2026-09-16: this row keeps its 2026-08-24 key 3db16e6d…; Figma-AI's #634434 reports c1e1a0e3073dd5e1e7fc31dc47c4654614a1a0b7 for the same section node. Sections have no stable key semantics — the authoritative per-SET keys live in button.json $meta.componentKeys. Unresolved, harmless. [nav+page added 2026-09-21 from Figma-AI enhanced mapping (C360-44235)]",
      "type": "SECTION",
      "figmaName": "Button Components",
      "pageId": "0:1",
      "pageName": "Button",
      "figmaUrl": "https://www.figma.com/design/4bh29laapcuKBTghfaRXF0/?node-id=26938-66536",
      "atomNodeIds": {
        "button-primary": "26938:60379"
      },
      "componentKeys": {
        "button-primary (26938:60379)": "48933add2d3d3fb41487818535e0259f72b76764"
      }
    },
    {
      "name": "Form Fields (family index)",
      "componentKey": "e2b8bc625076cfbb42c55490a0f023be6ff8152c",
      "nodeId": "26955:66554",
      "maturity": "draft",
      "semanticDependencies": [
        "shared/primitives",
        "portals/agency/semantics/color-modes",
        "portals/agency/semantics/density-modes"
      ],
      "contractPath": "portals/agency/components/form-fields.md",
      "jiraIssue": "C360-47183",
      "snapshotRef": "measured-live-figma-2026-09-10",
      "componentKeyNote": "CONFLICT recorded 2026-09-16: row keeps its recorded e2b8bc62… key; Figma-AI #634434 says null for the section and provides member keys instead (they live on the member rows + field-atoms)."
    },
    {
      "name": "form-field-primary (PRIMARY — view mode)",
      "componentKey": "917fa5da1872c6edbd940528351ae576fdc759ec",
      "componentKeyStatus": "Figma-AI Plugin-API extraction 2026-09-16 (C360-44235 #634434); accepted because the payload's nodeIds matched this mapping's live-verified nodeIds exactly. Keys themselves are Plugin-API-sourced.",
      "nodeId": "26938:65997",
      "maturity": "draft",
      "semanticDependencies": [
        "shared/primitives",
        "portals/agency/semantics/color-modes",
        "portals/agency/semantics/density-modes"
      ],
      "contractPath": "portals/agency/components/form-field-primary.md",
      "jiraIssue": "C360-47183",
      "snapshotRef": "measured-live-figma-2026-09-10 (contract 2.0.0)",
      "type": "COMPONENT_SET",
      "figmaName": "form-field-primary",
      "pageId": "26581:38709",
      "pageName": "AI components and Sample Mockups",
      "figmaUrl": "https://www.figma.com/design/4bh29laapcuKBTghfaRXF0/?node-id=26938-65997",
      "componentKeyNote": "[nav+page added 2026-09-21 from Figma-AI enhanced mapping (C360-44235)]"
    },
    {
      "name": "form-field-secondary (SECONDARY — edit mode)",
      "componentKey": "3731f44f052582e0d75bedd472829070a5ee6dd2",
      "componentKeyStatus": "Figma-AI Plugin-API extraction 2026-09-16 (C360-44235 #634434); accepted because the payload's nodeIds matched this mapping's live-verified nodeIds exactly. Keys themselves are Plugin-API-sourced.",
      "nodeId": "27062:7663",
      "maturity": "draft",
      "semanticDependencies": [
        "shared/primitives",
        "portals/agency/semantics/color-modes",
        "portals/agency/semantics/density-modes"
      ],
      "contractPath": "portals/agency/components/form-field-secondary.md",
      "jiraIssue": "C360-47325",
      "snapshotRef": "measured-live-figma-2026-09-10",
      "type": "COMPONENT_SET",
      "figmaName": "form-field-secondary",
      "pageId": "26581:38709",
      "pageName": "AI components and Sample Mockups",
      "figmaUrl": "https://www.figma.com/design/4bh29laapcuKBTghfaRXF0/?node-id=27062-7663",
      "componentKeyNote": "[nav+page added 2026-09-21 from Figma-AI enhanced mapping (C360-44235)]"
    },
    {
      "name": "form-field-tertiary (TERTIARY — settings)",
      "componentKey": "7cf8801c17ad3da0ce31bc619dfd009e6f7b3a88",
      "componentKeyStatus": "Figma-AI Plugin-API extraction 2026-09-16 (C360-44235 #634434); accepted because the payload's nodeIds matched this mapping's live-verified nodeIds exactly. Keys themselves are Plugin-API-sourced.",
      "nodeId": "27395:30147",
      "maturity": "draft",
      "semanticDependencies": [
        "shared/primitives",
        "portals/agency/semantics/color-modes",
        "portals/agency/semantics/density-modes"
      ],
      "contractPath": "portals/agency/components/form-field-tertiary.md",
      "jiraIssue": "C360-47325",
      "snapshotRef": "measured-live-figma-2026-09-10-pm",
      "type": "COMPONENT",
      "figmaName": "form-field-tertiary",
      "pageId": "26581:38709",
      "pageName": "AI components and Sample Mockups",
      "figmaUrl": "https://www.figma.com/design/4bh29laapcuKBTghfaRXF0/?node-id=27395-30147",
      "componentKeyNote": "[nav+page added 2026-09-21 from Figma-AI enhanced mapping (C360-44235)]"
    },
    {
      "name": "Field Atoms (shared)",
      "nodeIdNote": "corrected 2026-09-10 (audit finding): this row's nodeId names only ONE of the four atoms in field-atoms.md (field-input) — it has no single container node in Figma. The other three atoms live at 27062:10162 (field-label), 27388:28274 (field-header-primary), 11116:25116 (field-message). Use this row to find the contract; use the four node ids above to resolve a specific atom.",
      "atomNodeIds": {
        "field-label": "27062:10162",
        "field-header-primary": "27388:28274",
        "field-input": "27062:8145",
        "field-message": "11116:25116"
      },
      "componentKey": "df954272c64fa7996ae1485b37da10350908bf11",
      "componentKeyStatus": "Figma-AI Plugin-API extraction 2026-09-16 (C360-44235 #634434); accepted because the payload's nodeIds matched this mapping's live-verified nodeIds exactly. Keys themselves are Plugin-API-sourced.",
      "nodeId": "27062:8145",
      "maturity": "draft",
      "semanticDependencies": [
        "shared/primitives",
        "portals/agency/semantics/color-modes",
        "portals/agency/semantics/density-modes"
      ],
      "contractPath": "portals/agency/components/field-atoms.md",
      "jiraIssue": "C360-47325",
      "snapshotRef": "measured-live-figma-2026-09-10-pm",
      "type": "COMPONENT_SET",
      "figmaName": "field-input",
      "pageId": "26581:38709",
      "pageName": "AI components and Sample Mockups",
      "figmaUrl": "https://www.figma.com/design/4bh29laapcuKBTghfaRXF0/?node-id=27062-8145",
      "componentKeyNote": "[nav+page added 2026-09-21 from Figma-AI enhanced mapping (C360-44235)]",
      "componentKeys": {
        "field-label (27062:10162)": "806dbc1b800b59d9ebfc78b71b5f3bce5f648cd9",
        "field-header-primary (27388:28274)": "8d5035ef15e0c97aca55476d0c6a46004cbf5f88",
        "field-message (11116:25116)": "d7cd4015dbee59022c2c0024b7a6a66c45f8f82f",
        "field-input (27062:8145)": "df954272c64fa7996ae1485b37da10350908bf11"
      }
    },
    {
      "name": "Filters",
      "componentKey": null,
      "componentKeyStatus": "section/family rows carry no single key — per-set keys in componentKeys. Figma-AI Plugin-API extraction 2026-09-16 (C360-44235 #634434); accepted because the payload's nodeIds matched this mapping's live-verified nodeIds exactly. Keys themselves are Plugin-API-sourced.",
      "nodeId": "26955:66555",
      "nodeIdNote": "Owner ruling 2026-09-21 (Singh: proceed) — the canonical registry node for the Filters family is the outer family section 26955:66555 (Figma-AI recommendation, C360-44235 16:56 / C360-44907). The nested 'Filter Components' section 27356:74769 is where filters.md / filters.json geometry was measured live 2026-09-08 and remains the contract's figmaSectionNodeId (unchanged). Child atom component-set keys are in componentKeys (filter-dropdown 26360:67677, filter-toggle 26938:65213, filter-checkbox 26938:65443). The 2026-09-16 18:36 enhanced-mapping spec's child ids 7926:11853/11854/11852 were spurious and are SUPERSEDED.",
      "maturity": "draft",
      "semanticDependencies": [
        "shared/primitives",
        "portals/agency/semantics/color-modes",
        "portals/agency/semantics/density-modes"
      ],
      "contractPath": "portals/agency/components/filters.md",
      "jiraIssue": "C360-3526",
      "snapshotRef": "measured-live-figma-2026-09-08",
      "componentKeys": {
        "filter-dropdown (26360:67677)": "550179701b6812992f91be165ce9d0adbd9516d8",